[
  {
    "id": "q001",
    "question": "根据麦肯锡预测，到2030年AI在医疗领域的市场规模将超过多少亿美元？",
    "golden_answer": "到2030年，AI在医疗领域的市场规模将超过1500亿美元。",
    "kb_id": "6907257c-1cbc-4091-a035-b01ed06bd335",
    "source_file": "01-人工智能在医疗领域的应用.txt",
    "context_chunks": [
      {
        "text": "# 人工智能在医疗领域的应用  \n## 1. 引言  \n人工智能技术正在深刻改变医疗健康行业的面貌。从影像诊断到药物研发，从个性化治疗到医院管理，AI 的应用正在帮助医疗工作者提高效率、降低错误率，并为患者带来更好的治疗效果。据麦肯锡预测，到 2030 年，AI 在医疗领域的市场规模将超过 1500 亿美元。",
        "source": "01-人工智能在医疗领域的应用.txt",
        "score": 0.9999216794967651,
        "rank": 1
      },
      {
        "text": "## 7. 挑战与展望  \n尽管 AI 在医疗领域取得了显著进展，但仍然面临诸多挑战。数据隐私和安全是首要关切，医疗数据的敏感性要求严格的数据保护措施。联邦学习等隐私计算技术为在保护患者隐私的前提下进行模型训练提供了可能。  \n模型的可解释性是另一个关键问题。在医疗决策中，\"为什么\"与\"是什么\"同样重要。解释性 AI 技术正在发展，但距离满足临床需求还有差距。  \n此外，AI 系统的公平性、监管审批流程、医生与 AI 的协作模式等问题也需要行业、监管机构和学术界共同探索解决。",
        "source": "01-人工智能在医疗领域的应用.txt",
        "score": 0.058180972933769226,
        "rank": 2
      },
      {
        "text": "## 3. 药物研发  \n传统药物研发周期通常需要 10-15 年，平均成本高达 26 亿美元。AI 技术正在从根本上改变这一局面。通过深度学习模型分析蛋白质结构、预测药物分子与靶点的相互作用，可以将先导化合物的发现时间从数年缩短到数月甚至数周。  \nDeepMind 的 AlphaFold 2 在蛋白质结构预测上取得了革命性突破，预测精度达到了原子级别。随后发布的 AlphaFold 3 进一步扩展到了核酸、小分子和离子等多种生物分子的结构预测，为药物设计提供了全新的工具。  \nInsilico Medicine 利用 AI 平台发现的抗纤维化药物已进入二期临床试验，整个过程仅用时 18 个月，研发成本仅为传统方法的十分之一。",
        "source": "01-人工智能在医疗领域的应用.txt",
        "score": 0.023274624720215797,
        "rank": 3
      },
      {
        "text": "## 4. 个性化治疗  \nAI 正在推动医疗从\"一刀切\"模式向个性化、精准化方向转变。通过分析患者的基因组数据、生活方式、环境因素和病史，AI 系统能够为每位患者量身定制最优的治疗方案。  \n在肿瘤治疗领域，IBM Watson for Oncology 通过分析海量的医学文献和临床指南，为肿瘤科医生提供基于循证医学的治疗建议。虽然该项目最终未能完全达到预期，但它开辟了 AI 辅助临床决策的先河。",
        "source": "01-人工智能在医疗领域的应用.txt",
        "score": 0.007138763088732958,
        "rank": 4
      },
      {
        "text": "在肿瘤治疗领域，IBM Watson for Oncology 通过分析海量的医学文献和临床指南，为肿瘤科医生提供基于循证医学的治疗建议。虽然该项目最终未能完全达到预期，但它开辟了 AI 辅助临床决策的先河。  \nTempus 公司建立了世界上最大的临床和分子数据库之一，利用机器学习模型预测患者对不同治疗方案的反应，帮助医生选择最有效的化疗方案。",
        "source": "01-人工智能在医疗领域的应用.txt",
        "score": 0.00010800701420521364,
        "rank": 5
      },
      {
        "text": "## 二、异步编程\nPython 的 asyncio 生态日益成熟。FastAPI 是目前最流行的异步 Web 框架,其性能接近 Node.js,显著优于传统的 Flask 和 Django。\n使用 async/await 时需要注意:不要在异步函数中调用同步阻塞操作(如 requests 库),否则会阻塞事件循环。应该使用 httpx 等异步库替代,或者用 asyncio.to_thread 将同步操作放到线程池中执行。\n数据库方面,SQLAlchemy 2.0 提供了完善的异步支持。通过 AsyncSession 和 async 查询方法,可以在不修改业务逻辑的情况下获得异步性能。但需要注意惰性加载在异步上下文中会失败,应该使用 selectinload 或 joinedload 预加载关联数据。",
        "source": "03-Python后端开发最佳实践.txt",
        "score": 3.744670175365172e-05,
        "rank": 6
      },
      {
        "text": "## 三、依赖注入\n依赖注入是构建可测试、可维护后端服务的核心模式。FastAPI 内置了强大的依赖注入系统——Depends,可以将认证、数据库会话、配置等作为依赖项注入到路由函数中。\n实践中应该避免创建全局的单例对象。将外部依赖(数据库连接、Redis 客户端、外部 API 客户端)通过依赖注入的方式传递给业务代码,使得单元测试时可以轻松替换为 mock 对象。",
        "source": "03-Python后端开发最佳实践.txt",
        "score": 3.7444846384460106e-05,
        "rank": 7
      },
      {
        "text": "## 3. 训练流程  \n现代大语言模型的训练通常分为三个阶段：预训练（Pre-training）、有监督微调（SFT）和人类反馈对齐（Alignment）。",
        "source": "04-大语言模型技术综述.txt",
        "score": 3.743788329302333e-05,
        "rank": 8
      },
      {
        "text": "## 五、错误处理\n统一的错误处理策略对 API 的可用性至关重要。应该定义全局异常处理器,捕获未经处理的异常并转换为标准化的错误响应格式。\n业务异常应该继承自自定义的基类(如 AppException),包含错误码、错误消息和 HTTP 状态码。在异常处理器中根据异常类型映射到对应的 HTTP 响应。\nFastAPI 的 HTTPException 适用于简单的场景,但对于复杂的业务错误,建议使用自定义异常类配合全局异常过滤器。",
        "source": "03-Python后端开发最佳实践.txt",
        "score": 3.7436704587889835e-05,
        "rank": 9
      },
      {
        "text": "# Python Web 后端开发最佳实践  \n## 一、项目结构\n一个清晰的项目结构是工程化的基础。推荐使用以下分层架构:\n```\nproject/\nsrc/\napi/          # 路由层 - 处理 HTTP 请求和响应\nservices/     # 业务逻辑层\nmodels/       # 数据模型层\nrepositories/ # 数据访问层\nutils/        # 工具函数\nconfig/       # 配置管理\ntests/          # 测试代码\nmigrations/     # 数据库迁移\nscripts/        # 运维脚本\n```\n分层的好处是每层职责清晰,便于测试和维护。路由层只负责参数验证和响应格式化,业务逻辑放在 services 中,数据操作通过 repositories 抽象,这样可以在不修改业务逻辑的情况下更换数据库。",
        "source": "03-Python后端开发最佳实践.txt",
        "score": 3.743559864233248e-05,
        "rank": 10
      }
    ]
  },
  {
    "id": "q002",
    "question": "医学影像诊断中，哪些深度学习模型在分析X光片、CT扫描和MRI图像方面展现出超越人类放射科医生的准确率？",
    "golden_answer": "深度学习模型，特别是卷积神经网络(CNN)和Transformer架构，在分析X光片、CT扫描和MRI图像方面已经展现出超越人类放射科医生的准确率。",
    "kb_id": "6907257c-1cbc-4091-a035-b01ed06bd335",
    "source_file": "01-人工智能在医疗领域的应用.txt",
    "context_chunks": [
      {
        "text": "## 2. 医学影像诊断  \n医学影像诊断是 AI 在医疗领域最成熟的应用方向之一。深度学习模型，特别是卷积神经网络（CNN）和 Transformer 架构，在分析 X 光片、CT 扫描和 MRI 图像方面已经展现出超越人类放射科医生的准确率。  \nGoogle DeepMind 开发的视网膜疾病检测系统能够识别 50 多种眼部疾病，准确率达到 94% 以上。在中国，联影智能的 AI 辅助诊断系统已经部署在超过 800 家医院，累计辅助诊断超过 2000 万例。  \nAI 影像诊断的核心优势在于其一致性——机器不会因为疲劳而漏诊，能够在海量图像中快速定位异常区域，并给出量化分析结果。",
        "source": "01-人工智能在医疗领域的应用.txt",
        "score": 0.9999289512634277,
        "rank": 1
      },
      {
        "text": "## 3. 药物研发  \n传统药物研发周期通常需要 10-15 年，平均成本高达 26 亿美元。AI 技术正在从根本上改变这一局面。通过深度学习模型分析蛋白质结构、预测药物分子与靶点的相互作用，可以将先导化合物的发现时间从数年缩短到数月甚至数周。  \nDeepMind 的 AlphaFold 2 在蛋白质结构预测上取得了革命性突破，预测精度达到了原子级别。随后发布的 AlphaFold 3 进一步扩展到了核酸、小分子和离子等多种生物分子的结构预测，为药物设计提供了全新的工具。  \nInsilico Medicine 利用 AI 平台发现的抗纤维化药物已进入二期临床试验，整个过程仅用时 18 个月，研发成本仅为传统方法的十分之一。",
        "source": "01-人工智能在医疗领域的应用.txt",
        "score": 0.018562715500593185,
        "rank": 2
      },
      {
        "text": "## 4. 个性化治疗  \nAI 正在推动医疗从\"一刀切\"模式向个性化、精准化方向转变。通过分析患者的基因组数据、生活方式、环境因素和病史，AI 系统能够为每位患者量身定制最优的治疗方案。  \n在肿瘤治疗领域，IBM Watson for Oncology 通过分析海量的医学文献和临床指南，为肿瘤科医生提供基于循证医学的治疗建议。虽然该项目最终未能完全达到预期，但它开辟了 AI 辅助临床决策的先河。",
        "source": "01-人工智能在医疗领域的应用.txt",
        "score": 0.0017069627065211535,
        "rank": 3
      },
      {
        "text": "## 7. 挑战与展望  \n尽管 AI 在医疗领域取得了显著进展，但仍然面临诸多挑战。数据隐私和安全是首要关切，医疗数据的敏感性要求严格的数据保护措施。联邦学习等隐私计算技术为在保护患者隐私的前提下进行模型训练提供了可能。  \n模型的可解释性是另一个关键问题。在医疗决策中，\"为什么\"与\"是什么\"同样重要。解释性 AI 技术正在发展，但距离满足临床需求还有差距。  \n此外，AI 系统的公平性、监管审批流程、医生与 AI 的协作模式等问题也需要行业、监管机构和学术界共同探索解决。",
        "source": "01-人工智能在医疗领域的应用.txt",
        "score": 0.001696888473816216,
        "rank": 4
      },
      {
        "text": "## 6. 医疗 NLP 与知识管理  \n自然语言处理技术在医疗领域的应用日益广泛。医疗记录包含了大量非结构化文本数据——病历、检查报告、手术记录、出院小结等。AI 驱动的 NLP 系统能够自动从这些文本中提取关键信息、生成结构化数据，并支持临床决策。  \n电子病历（EMR）系统的智能化是当前医疗信息化的重要趋势。通过 NLP 技术实现智能编码、自动摘要和质控检查，可以显著减轻医生的工作负担，让他们将更多时间投入到患者护理中。  \n知识图谱技术在医疗知识管理中也展现出巨大潜力。通过构建疾病-症状-药物-治疗的知识网络，AI 系统能够发现隐含的关联关系，支持罕见病的诊断和药物再利用的研究。",
        "source": "01-人工智能在医疗领域的应用.txt",
        "score": 0.0010683550499379635,
        "rank": 5
      },
      {
        "text": "在肿瘤治疗领域，IBM Watson for Oncology 通过分析海量的医学文献和临床指南，为肿瘤科医生提供基于循证医学的治疗建议。虽然该项目最终未能完全达到预期，但它开辟了 AI 辅助临床决策的先河。  \nTempus 公司建立了世界上最大的临床和分子数据库之一，利用机器学习模型预测患者对不同治疗方案的反应，帮助医生选择最有效的化疗方案。",
        "source": "01-人工智能在医疗领域的应用.txt",
        "score": 0.0008478916133753955,
        "rank": 6
      },
      {
        "text": "## 3. 训练流程  \n现代大语言模型的训练通常分为三个阶段：预训练（Pre-training）、有监督微调（SFT）和人类反馈对齐（Alignment）。",
        "source": "04-大语言模型技术综述.txt",
        "score": 0.0005040903342887759,
        "rank": 7
      },
      {
        "text": "现代大语言模型的训练通常分为三个阶段：预训练（Pre-training）、有监督微调（SFT）和人类反馈对齐（Alignment）。  \n预训练阶段使用海量文本数据（通常数 TB），通过语言建模任务学习语言的统计规律。这个阶段最消耗计算资源，GPT-4 的预训练估计花费超过 1 亿美元。数据质量对预训练效果影响巨大，数据清洗和去重是关键步骤。  \n有监督微调（SFT）使用高质量的人工标注指令-回复对来训练模型，使其学会遵循人类指令。相比预训练，SFT 的计算成本低得多，但对数据质量要求极高。  \nRLHF（人类反馈强化学习）是使模型输出符合人类偏好的关键技术。首先训练一个奖励模型来预测人类对输出的偏好，然后用强化学习（PPO 算法）来优化语言模型。DPO（Direct Preference Optimization）是 RLHF 的简化替代方案，省去了训练奖励模型的步骤，直接在偏好数据上优化策略。",
        "source": "04-大语言模型技术综述.txt",
        "score": 0.0002312492288183421,
        "rank": 8
      },
      {
        "text": "# 大语言模型技术综述  \n## 1. 发展历程  \n大语言模型（Large Language Model，LLM）的发展经历了从统计语言模型到神经网络语言模型，再到预训练语言模型，最终到如今的大规模预训练模型的演进过程。  \n2017 年，Google 提出的 Transformer 架构彻底改变了 NLP 领域。Transformer 通过自注意力机制（Self-Attention）克服了 RNN 无法并行计算和长距离依赖建模的局限。  \n2018 年，OpenAI 发布 GPT-1，Google 发布 BERT，标志着\"预训练+微调\"范式的兴起。BERT 采用双向编码器，在理解类任务上表现出色；GPT 采用单向解码器，在生成类任务上有天然优势。  \n2020 年，OpenAI 的 GPT-3 以 1750 亿参数将语言模型的规模推向了新高度，并展示了令人惊讶的 In-Context Learning 能力——仅仅通过几个示例，模型就能完成各种 NLP 任务而不需要微调。  \n2022 年末，ChatGPT 的发布引爆了全球 AI 浪潮。基于 GPT-3.5 并通过 RLHF（人类",
        "source": "04-大语言模型技术综述.txt",
        "score": 8.502968557877466e-05,
        "rank": 9
      },
      {
        "text": "## 七、性能优化\n数据库查询是最常见的性能瓶颈。N+1 查询问题可以通过预加载关联数据解决。对于复杂查询,可以使用 EXPLAIN ANALYZE 分析执行计划,添加合适的索引。\n缓存策略应该根据数据特性选择。频繁读取但很少变更的数据适合用 Redis 缓存;需要实时计算的数据可以考虑用异步任务预计算。\nAPI 响应压缩(Brotli/Gzip)可以显著减少网络传输量。对于大型列表接口,分页是强制性的。对于实时性要求不高的查询,可以考虑使用 ETag 或 Last-Modified 实现条件请求,减少不必要的数据传输。",
        "source": "03-Python后端开发最佳实践.txt",
        "score": 6.378928082995117e-05,
        "rank": 10
      }
    ]
  },
  {
    "id": "q003",
    "question": "Google DeepMind开发的视网膜疾病检测系统能够识别多少种眼部疾病，准确率达到多少？",
    "golden_answer": "Google DeepMind开发的视网膜疾病检测系统能够识别50多种眼部疾病，准确率达到94%以上。",
    "kb_id": "6907257c-1cbc-4091-a035-b01ed06bd335",
    "source_file": "01-人工智能在医疗领域的应用.txt",
    "context_chunks": [
      {
        "text": "## 2. 医学影像诊断  \n医学影像诊断是 AI 在医疗领域最成熟的应用方向之一。深度学习模型，特别是卷积神经网络（CNN）和 Transformer 架构，在分析 X 光片、CT 扫描和 MRI 图像方面已经展现出超越人类放射科医生的准确率。  \nGoogle DeepMind 开发的视网膜疾病检测系统能够识别 50 多种眼部疾病，准确率达到 94% 以上。在中国，联影智能的 AI 辅助诊断系统已经部署在超过 800 家医院，累计辅助诊断超过 2000 万例。  \nAI 影像诊断的核心优势在于其一致性——机器不会因为疲劳而漏诊，能够在海量图像中快速定位异常区域，并给出量化分析结果。",
        "source": "01-人工智能在医疗领域的应用.txt",
        "score": 0.9999169111251831,
        "rank": 1
      },
      {
        "text": "## 七、性能优化\n数据库查询是最常见的性能瓶颈。N+1 查询问题可以通过预加载关联数据解决。对于复杂查询,可以使用 EXPLAIN ANALYZE 分析执行计划,添加合适的索引。\n缓存策略应该根据数据特性选择。频繁读取但很少变更的数据适合用 Redis 缓存;需要实时计算的数据可以考虑用异步任务预计算。\nAPI 响应压缩(Brotli/Gzip)可以显著减少网络传输量。对于大型列表接口,分页是强制性的。对于实时性要求不高的查询,可以考虑使用 ETag 或 Last-Modified 实现条件请求,减少不必要的数据传输。",
        "source": "03-Python后端开发最佳实践.txt",
        "score": 0.00013971226871944964,
        "rank": 2
      },
      {
        "text": "## 4. 个性化治疗  \nAI 正在推动医疗从\"一刀切\"模式向个性化、精准化方向转变。通过分析患者的基因组数据、生活方式、环境因素和病史，AI 系统能够为每位患者量身定制最优的治疗方案。  \n在肿瘤治疗领域，IBM Watson for Oncology 通过分析海量的医学文献和临床指南，为肿瘤科医生提供基于循证医学的治疗建议。虽然该项目最终未能完全达到预期，但它开辟了 AI 辅助临床决策的先河。",
        "source": "01-人工智能在医疗领域的应用.txt",
        "score": 8.090134360827506e-05,
        "rank": 3
      },
      {